"What about all of the contact with the Clinton campaign and the Russians? Also, is it true that the DNC would not let the FBI in to look?","843813078076719107","2017-03-20 13:14:49"
"Just heard Fake News CNN is doing polls again despite the fact that their election polls were a WAY OFF disaster. Much higher ratings at Fox","843803115044454402","2017-03-20 12:35:14"
"The real story that Congress, the FBI and all others should be looking into is the leaking of Classified information. Must find leaker now!","843779892776964097","2017-03-20 11:02:57"
"The Democrats made up and pushed the Russian story as an excuse for running a terrible campaign. Big advantage in Electoral College & lost!","843776582825267201","2017-03-20 10:49:48"
"James Clapper and others stated that there is no evidence Potus colluded with Russia. This story is FAKE NEWS and everyone knows it!","843772976151642112","2017-03-20 10:35:28"
"Despite what you have heard from the FAKE NEWS, I had a GREAT meeting with German Chancellor Angela Merkel. Nevertheless, Germany owes vast sums of money to NATO & the United States must be paid more for the powerful, and very expensive, defense it provides to Germany!","",""
"North Korea is behaving very badly. They have been ""playing"" the United States for years. China has done little to help!","842724011234791424","2017-03-17 13:07:15"
"My representatives had a great meeting w/ the Hispanic Chamber of Commerce at the WH today. Look forward to tremendous growth & future mtgs!","842506649122279425","2017-03-16 22:43:32"
"CEO's most optimistic since 2009. It will only get better as we continue to slash unnecessary regulations and when we begin our big tax cut!","841985915778142209","2017-03-15 12:14:20"
"Looking forward to a big rally in Nashville, Tennessee, tonight. Big crowd of great people expected. Will be fun!","841974528683192320","2017-03-15 11:29:05"
"Will be going to Detroit, Michigan (love), today for a big meeting on bringing back car production to State & U․S․. Already happening!","841970726341074945","2017-03-15 11:13:58"
"ObamaCare is imploding. It is a disaster and 2017 will be the worst year yet, by far! Republicans will come together and save the day.","841275470796738560","2017-03-13 13:11:17"
"We are making great progress with healthcare. ObamaCare is imploding and will only get worse. Republicans coming together to get job done!","840572799202783233","2017-03-11 14:39:07"
"Despite what you hear in the press, healthcare is coming along great. We are talking to many groups and it will end in a beautiful picture!","839883804315684864","2017-03-09 17:01:17"
"LinkedIn Workforce Report: January and February were the strongest consecutive months for hiring since August and September 2015","839448469374894080","2017-03-08 12:11:25"
"On International Women's Day, join me in honoring the critical role of women here in America & around the world.","839433951957696513","2017-03-08 11:13:44"
"I have tremendous respect for women and the many roles they serve that are vital to the fabric of our society and our economy.","839433678275153921","2017-03-08 11:12:39"
"Don't let the FAKE NEWS tell you that there is big infighting in the Trump Admin. We are getting along great, and getting major things done!","839116941956640768","2017-03-07 14:14:03"
"I am working on a new system where there will be competition in the Drug Industry. Pricing for the American people will come way down!","839110000870109184","2017-03-07 13:46:28"
"Our wonderful new Healthcare Bill is now out for review and negotiation. ObamaCare is a complete and total disaster - is imploding fast!","839086723552411648","2017-03-07 12:13:59"
"122 vicious prisoners, released by the Obama Administration from Gitmo, have returned to the battlefield. Just another terrible decision!","839084268991229952","2017-03-07 12:04:13"
"45,000 construction & manufacturing jobs in the U․S․. Gulf Coast region. $20 billion investment. We are already winning again, America!","838862312685637640","2017-03-06 21:22:15"
"Thank you for the great rallies all across the country. Tremendous support. Make America Great Again!","838441522546769923","2017-03-05 17:30:11"
"Is it true the DNC would not allow the FBI access to check server or other equipment after learning it was hacked? Can that be possible?","838351476401520640","2017-03-05 11:32:22"
"Arnold Schwarzenegger isn't voluntarily leaving the Apprentice, he was fired by his bad (pathetic) ratings, not by me. Sad end to great show","838016045222854656","2017-03-04 13:19:29"
"How low has President Obama gone to tapp my phones during the very sacred election process. This is Nixon/Watergate. Bad (or sick) guy!","837996746236182529","2017-03-04 12:02:48"
"I'd bet a good lawyer could make a great case out of the fact that President Obama was tapping my phones in October, just prior to Election!","837994257566863360","2017-03-04 11:52:54"
"Is it legal for a sitting President to be ""wire tapping"" a race for president prior to an election? Turned down by court earlier. A NEW LOW!","837993273679560704","2017-03-04 11:49:00"
"Just out: The same Russian Ambassador that met Jeff Sessions visited the Obama White House 22 times, and 4 times last year alone.","837991759045079040","2017-03-04 11:42:59"
"The first meeting Jeff Sessions had with the Russian Amb was set up by the Obama Administration under education program for 100 Ambs Terrible! Just found out that Obama had my ""wires tapped"" in Trump Tower just before the victory. Nothing found. This is McCarthyism!","",""
"It is so pathetic that the Dems have still not approved my full Cabinet.","837638488656920576","2017-03-03 12:19:12"
"Jeff Sessions is an honest man. He did not say anything wrong. He could have stated his response more accurately, but it was clearly not intentional. This whole narrative is a way of saving face for Democrats losing an election that everyone thought they were supposed to win. The Democrats are overplaying their hand. They lost the election, and now they have lost their grip on reality. The real story is all of the illegal leaks of classified and other information. It is a total ""witch hunt!""","",""
"Since November 8th, Election Day, the Stock Market has posted $3.2 trillion in GAINS and consumer confidence is at a 15 year high. Jobs!","837256338203881472","2017-03-02 11:00:41"
"THANK YOU!","836933725602656256","2017-03-01 13:38:44"
"Big dinner with Governors tonight at White House. Much to be discussed, including healthcare.","835946001873657858","2017-02-26 20:13:52"
"Russia talk is FAKE NEWS put out by the Dems, and played up by the media, in order to mask the big election defeat and the illegal leaks!","835916511944523777","2017-02-26 18:16:41"
"The race for DNC Chairman was, of course, totally ""rigged."" Bernie's guy, like Bernie himself, never had a chance. Clinton demanded Perez!","835814988686233601","2017-02-26 11:33:16"
"Congratulations to Thomas Perez, who has just been named Chairman of the DNC. I could not be happier for him, or for the Republican Party!","835610917568200705","2017-02-25 22:02:22"
"I will not be attending the White House Correspondents' Association Dinner this year. Please wish everyone well and have a great evening!","835608648625836032","2017-02-25 21:53:21"
"Great optimism for future of U․S․ business, AND JOBS, with the DOW having an 11th straight record close. Big tax & regulation cuts coming!","835481237879926784","2017-02-25 13:27:04"
"The media has not reported that the National Debt in my first month went down by $12 billion vs a $200 billion increase in Obama first mo.","835479283699224576","2017-02-25 13:19:18"
"Maybe the millions of people who voted to MAKE AMERICA GREAT AGAIN should have their own rally. It would be the biggest of them all!","835465719970217984","2017-02-25 12:25:24"
"Going to CPAC!","835124485632180224","2017-02-24 13:49:27"
"The FBI is totally unable to stop the national security ""leakers"" that have permeated our government for a long time. They can't even find the leakers within the FBI itself. Classified information is being given to media that could have a devastating effect on U․S․. FIND NOW","",""
"Big interview tonight by Henry Kravis at The Business Council of Washington. Looking forward to it!","834917440450609152","2017-02-24 00:06:44"
"Seven people shot and killed yesterday in Chicago. What is going on there - totally out of control. Chicago needs help!","834916167177371648","2017-02-24 00:01:40"
"Very much enjoyed my tour of the Smithsonian's National Museum of African American History and Culture…A great job done by amazing people!","834384982495940613","2017-02-22 12:50:56"
"One thing I will say about Rep. Keith Ellison, in his fight to lead the DNC, is that he was the one who predicted early that I would win!","834377364947816448","2017-02-22 12:20:40"
"The so-called angry crowds in home districts of some Republicans are actually, in numerous cases, planned out by liberal activists. Sad!","834181712783560705","2017-02-21 23:23:13"
"Just named General H․R․. McMaster National Security Advisor.","833783438922629125","2017-02-20 21:00:37"
"HAPPY PRESIDENTS DAY - MAKE AMERICA GREAT AGAIN!","833686030679207936","2017-02-20 14:33:33"
"Give the public a break - The FAKE NEWS media is trying to say that large scale immigration in Sweden is working out just beautifully. NOT!","833681539997253636","2017-02-20 14:15:42"
"Will be having many meetings this weekend at The Southern White House. Big 5:00 P․M․ speech in Melbourne, Florida. A lot to talk about!","832950628750127106","2017-02-18 13:51:20"
"Don't believe the main stream (fake news) media.The White House is running VERY WELL. I inherited a MESS and am in the process of fixing it.","832945737625387008","2017-02-18 13:31:53"
"Looking forward to the Florida rally tomorrow. Big crowd expected!","832742165436579840","2017-02-18 00:02:58"
"""One of the most effective press conferences I've ever seen!"" says Rush Limbaugh. Many agree.Yet FAKE MEDIA calls it differently! Dishonest","832730328108134402","2017-02-17 23:15:56"
"General Keith Kellogg, who I have known for a long time, is very much in play for NSA - as are three others.","832579442790772736","2017-02-17 13:16:22"
"Thank you for all of the nice statements on the Press Conference yesterday. Rush Limbaugh said one of greatest ever. Fake media not happy!","832555987299082242","2017-02-17 11:43:10"
"Going to Charleston, South Carolina, in order to spend time with Boeing and talk jobs! Look forward to it.","832554772318322688","2017-02-17 11:38:20"
"Despite the long delays by the Democrats in finally approving Dr․ Tom Price, the repeal and replacement of ObamaCare is moving fast!","832533430168608768","2017-02-17 10:13:32"
"The Democrats had to come up with a story as to why they lost the election, and so badly (306), so they made up a story - RUSSIA. Fake news!","832238070460186625","2017-02-16 14:39:52"
"FAKE NEWS media, which makes up stories and ""sources,"" is far more effective than the discredited Democrats - but they are fading fast!","832230758299340800","2017-02-16 14:10:49"
"The spotlight has finally been put on the low-life leakers! They will be caught!","832198588201594880","2017-02-16 12:02:59"
"Stock market hits new high with longest winning streak in decades. Great level of confidence and optimism - even before tax plan rollout!","832191485701451777","2017-02-16 11:34:46"
"The real scandal here is that classified information is illegally given out by ""intelligence"" like candy. Very un-American!","831853862281699331","2017-02-15 13:13:10"
"Crimea was TAKEN by Russia during the Obama Administration. Was Obama too soft on Russia?","831846101179314177","2017-02-15 12:42:20"
"Thank you to Eli Lake of The Bloomberg View - ""The NSA & FBI…should not interfere in our politics…and is"" Very serious situation for USA","831842652085686273","2017-02-15 12:28:37"
"This Russian connection non-sense is merely an attempt to cover-up the many mistakes made in Hillary Clinton's losing campaign.","831837514226921472","2017-02-15 12:08:12"
"The real story here is why are there so many illegal leaks coming out of Washington? Will these leaks be happening as I deal on N․Korea etc?","831510532318429184","2017-02-14 14:28:54"
"Just leaving Florida. Big crowds of enthusiastic supporters lining the road that the FAKE NEWS media refuses to mention. Very dishonest!","830904083519242241","2017-02-12 22:19:05"
"Congratulations Stephen Miller- on representing me this morning on the various Sunday morning shows. Great job!","830804130692268032","2017-02-12 15:41:55"
"I know Mark Cuban well. He backed me big-time but I wasn't interested in taking all of his calls.He's not smart enough to run for president!","830769247185952772","2017-02-12 13:23:18"
"After two days of very productive talks, Prime Minister Abe is heading back to Japan. L","830764596235485188","2017-02-12 13:04:49"
"72% of refugees admitted into U․S․ (2/3 -2/11) during COURT BREAKDOWN are from 7 countries: SYRIA, IRAQ, SOMALIA, IRAN, SUDAN, LIBYA & YEMEN","830747067379232769","2017-02-12 11:55:10"
"The crackdown on illegal criminals is merely the keeping of my campaign promise. Gang members, drug dealers & others are being removed!","830741932099960834","2017-02-12 11:34:45"
"A working dinner tonight with Prime Minister Abe of Japan, and his representatives, at the Winter White House (Mar-a-Lago). Very good talks!","830558065715998726","2017-02-11 23:24:08"
"I am so proud of my daughter Ivanka. To be abused and treated so badly by the media, and to still hold her head so high, is truly wonderful!","830552079240409089","2017-02-11 23:00:21"
"Melania and I are hosting Japanese Prime Minister Shinzo Abe and Mrs․ Abe at Mar-a-Lago in Palm Beach, Fla. They are a wonderful couple!","830409522397184000","2017-02-11 13:33:53"
"I am reading that the great border WALL will cost more than the government originally thought, but I have not gotten involved in the design or negotiations yet. When I do, just like with the F-35 FighterJet or the Air Force One Program, price will come WAY DOWN!","",""
"Our legal system is broken! ""77% of refugees allowed into U․S․ since travel reprieve hail from seven suspect countries."" (WT) SO DANGEROUS!","830389130311921667","2017-02-11 12:12:51"
"LAWFARE: ""Remarkably, in the entire opinion, the panel did not bother even to cite this (the) statute."" A disgraceful decision!","830042498806460417","2017-02-10 13:15:27"
"SEE YOU IN COURT, THE SECURITY OF OUR NATION IS AT STAKE!","829836231802515457","2017-02-09 23:35:49"
"Sen․ McCain should not be talking about the success or failure of a mission to the media. Only emboldens the enemy! He's been losing so long he doesn't know how to win anymore, just look at the mess our country is in - bogged down in conflict all over the place. Our hero Ryan died on a winning mission ( according to General Mattis), not a ""failure."" Time for the U․S․ to get smart and start winning again!","",""
"Chris Cuomo, in his interview with Sen․ Blumenthal, never asked him about his long-term lie about his brave ""service"" in Vietnam. FAKE NEWS!","829681034564341760","2017-02-09 13:19:08"
"Sen․Richard Blumenthal, who never fought in Vietnam when he said for years he had (major lie),now misrepresents what Judge Gorsuch told him?","829660612452036608","2017-02-09 11:57:59"
"Big increase in traffic into our country from certain areas, while our people are far more vulnerable, as we wait for what should be EASY D!","829384587482656768","2017-02-08 17:41:09"
"If the U․S․ does not win this case as it so obviously should, we can never have the security and safety to which we are entitled. Politics!","829299566344359936","2017-02-08 12:03:18"
"It is a disgrace that my full Cabinet is still not in place, the longest such delay in the history of our country. Obstruction by Democrats!","829133645055135750","2017-02-08 01:04:00"
"I don't know Putin, have no deals in Russia, and the haters are going crazy - yet Obama can make a deal with Iran, #1 in terror, no problem!","828939235499638784","2017-02-07 12:11:29"
"The threat from radical Islamic terrorism is very real, just look at what is happening in Europe and the Middle-East. Courts must act fast!","828797801630937089","2017-02-07 02:49:28"
"I call my own shots, largely based on an accumulation of data, and everyone knows it. Some FAKE NEWS media, in order to marginalize, lies!","828575949268606977","2017-02-06 12:07:55"
"Any negative polls are fake news, just like the CNN, ABC, NBC polls in the election. Sorry, people want border security and extreme vetting.","828574430800539648","2017-02-06 12:01:53"
"What an amazing comeback and win by the Patriots. Tom Brady, Bob Kraft and Coach B are total winners. Wow!","828447350200926212","2017-02-06 03:36:54"
"Enjoy the #SuperBowl and then we continue: MAKE AMERICA GREAT AGAIN!","828375073006444544","2017-02-05 22:49:42"
"I have instructed Homeland Security to check people coming into our country VERY CAREFULLY. The courts are making the job very difficult!","828343072840900610","2017-02-05 20:42:33"
"Just cannot believe a judge would put our country in such peril. If something happens blame him and court system. People pouring in. Bad!","828342202174668800","2017-02-05 20:39:05"
"The judge opens up our country to potential terrorists and others that do not have our best interests at heart. Bad people are very happy!","828042506851934209","2017-02-05 00:48:12"
"Why aren't the lawyers looking at and using the Federal Court decision in Boston, which is at conflict with ridiculous lift ban decision?","828024835670413312","2017-02-04 23:37:59"
"Because the ban was lifted by a judge, many very bad and dangerous people may be pouring into our country. A terrible decision","827996357252243456","2017-02-04 21:44:49"
"What is our country coming to when a judge can halt a Homeland Security travel ban and anyone, even with bad intentions, can come into U․S․?","827981079042805761","2017-02-04 20:44:07"
"MAKE AMERICA GREAT AGAIN!","827885966509604865","2017-02-04 14:26:10"
"The opinion of this so-called judge, which essentially takes law-enforcement away from our country, is ridiculous and will be overturned!","827867311054974976","2017-02-04 13:12:02"
"Interesting that certain Middle-Eastern countries agree with the ban. They know if certain people are allowed in it's death & destruction!","827865957750161408","2017-02-04 13:06:39"
"When a country is no longer able to say who can, and who cannot , come in & out, especially for reasons of safety &.security - big trouble!","827864176043376640","2017-02-04 12:59:35"
"Countries charge U․S․ companies taxes or tariffs while the U․S․ charges them nothing or little.We should charge them SAME as they charge us!","827715246135574530","2017-02-04 03:07:47"
"We must keep ""evil"" out of our country!","827655062835052544","2017-02-03 23:08:38"
"A new radical Islamic terrorist has just attacked in Louvre Museum in Paris. Tourists were locked down. France on edge again. GET SMART U․S․","827499871011819520","2017-02-03 12:51:58"
"Professional anarchists, thugs and paid protesters are proving the point of the millions of people who voted to MAKE AMERICA GREAT AGAIN!","827483841589891073","2017-02-03 11:48:16"
"Meeting with biggest business leaders this morning. Good jobs are coming back to U․S․, health care and tax bills are being crafted NOW!","827482059438432260","2017-02-03 11:41:11"
"Thank you to Prime Minister of Australia for telling the truth about our very civil conversation that FAKE NEWS media lied about. Very nice!","827480386120929280","2017-02-03 11:34:32"
"Iran is playing with fire - they don't appreciate how ""kind"" President Obama was to them. Not me!","827478751931924480","2017-02-03 11:28:02"
"Yes, Arnold Schwarzenegger did a really bad job as Governor of California and even worse on the Apprentice…but at least he tried hard!","827477947154063361","2017-02-03 11:24:51"
"Iran was on its last legs and ready to collapse until the U․S․ came along and gave it a life-line in the form of the Iran Deal: $150 billion","827119326880813056","2017-02-02 11:39:49"
"Iran has been formally PUT ON NOTICE for firing a ballistic missile.Should have been thankful for the terrible deal the U․S․ made with them!","827118012784373760","2017-02-02 11:34:36"
"Attending Chief Ryan Owens' Dignified Transfer yesterday with my daughter Ivanka was my great honor. To a great and brave man - thank you!","827115768202534913","2017-02-02 11:25:40"
"Congratulations to Rex Tillerson on being sworn in as our new Secretary of State. He will be a star!","827113926517194757","2017-02-02 11:18:21"
"If U․C․. Berkeley does not allow free speech and practices violence on innocent people with a different point of view - NO FEDERAL FUNDS?","827112633224544256","2017-02-02 11:13:13"
"Do you believe it? The Obama Administration agreed to take thousands of illegal immigrants from Australia. Why? I will study this dumb deal!","827002559122567168","2017-02-02 03:55:49"
"Iran is rapidly taking over more and more of Iraq even after the U․S․ has squandered three trillion dollars there. Obvious long ago!","826990079738540033","2017-02-02 03:06:14"
"Everybody is arguing whether or not it is a BAN. Call it what you want, it is about keeping bad people (with bad intentions) out of country!","826774668245946368","2017-02-01 12:50:16"
"Hope you like my nomination of Judge Neil Gorsuch for the United States Supreme Court. He is a good and brilliant man, respected by all.","826637556787838976","2017-02-01 03:45:26"
"Getting ready to deliver a VERY IMPORTANT DECISION! 8:00 P․M․","826588658304217088","2017-02-01 00:31:08"
"When will the Democrats give us our Attorney General and rest of Cabinet! They should be ashamed of themselves! No wonder D․C․ doesn't work!","826391334248407040","2017-01-31 11:27:02"
"Nancy Pelosi and Fake Tears Chuck Schumer held a rally at the steps of The Supreme Court and mic did not work (a mess)-just like Dem party!","826390034693623809","2017-01-31 11:21:52"
"The Democrats are delaying my cabinet picks for purely political reasons. They have nothing going but to obstruct. Now have an Obama A․G․","826229971584708608","2017-01-31 00:45:50"
"Where was all the outrage from Democrats and the opposition party (the media) when our jobs were fleeing our country?","826073437735100418","2017-01-30 14:23:49"
"I have made my decision on who I will nominate for The United States Supreme Court. It will be announced live on Tuesday at 8:00 P․M․ (W.H․)","826063267760046080","2017-01-30 13:43:25"
"If the ban were announced with a one week notice, the ""bad"" would rush into our country during that week. A lot of bad ""dudes"" out there!","826060143825666051","2017-01-30 13:31:00"
"There is nothing nice about searching for terrorists before they can enter our country. This was a big part of my campaign. Study the world!","826044059647107073","2017-01-30 12:27:05"
"Only 109 people out of 325,000 were detained and held for questioning. Big problems at airports were caused by Delta computer outage, protesters and the tears of Senator Schumer. Secretary Kelly said that all is going well with very few problems. MAKE AMERICA SAFE AGAIN!","",""
"The joint statement of former presidential candidates John McCain & Lindsey Graham is wrong - they are sadly weak on immigration. The two Senators should focus their energies on ISIS, illegal immigration and border security instead of always looking to start World War III.","",""
"Christians in the Middle-East have been executed in large numbers. We cannot allow this horror to continue!","825721153142521858","2017-01-29 15:03:58"
"Our country needs strong borders and extreme vetting, NOW. Look what is happening all over Europe and, indeed, the world - a horrible mess!","825692045532618753","2017-01-29 13:08:18"
"The #MarchForLife is so important. To all of you marching --- you have my full support!","825017279209410561","2017-01-27 16:27:02"
"Mexico has taken advantage of the U․S․ for long enough. Massive trade deficits & little help on the very weak border must change, NOW!","824970003153842176","2017-01-27 13:19:10"
"Look forward to seeing final results of VoteStand. Gregg Phillips and crew say at least 3,000,000 votes were illegal. We must do better!","824968416486387713","2017-01-27 13:12:52"
"The U․S․ has a 60 billion dollar trade deficit with Mexico. It has been a one-sided deal from the beginning of NAFTA with massive numbers of jobs and companies lost. If Mexico is unwilling to pay for the badly needed wall, then it would be better to cancel the upcoming meeting.","",""
