"Getting ready to leave for Melbourne, Florida. See you all soon!","833050081641234435","2017-02-18 20:26:31"
"Will be having many meetings this weekend at The Southern White House. Big 5:00 P․M․ speech in Melbourne, Florida. A lot to talk about!","832950628750127106","2017-02-18 13:51:20"
"Don't believe the main stream (fake news) media.The White House is running VERY WELL. I inherited a MESS and am in the process of fixing it.","832945737625387008","2017-02-18 13:31:53"
"Looking forward to the Florida rally tomorrow. Big crowd expected!","832742165436579840","2017-02-18 00:02:58"
"""One of the most effective press conferences I've ever seen!"" says Rush Limbaugh. Many agree.Yet FAKE MEDIA calls it differently! Dishonest","832730328108134402","2017-02-17 23:15:56"
"General Keith Kellogg, who I have known for a long time, is very much in play for NSA - as are three others.","832579442790772736","2017-02-17 13:16:22"
"Thank you for all of the nice statements on the Press Conference yesterday. Rush Limbaugh said one of greatest ever. Fake media not happy!","832555987299082242","2017-02-17 11:43:10"
"Going to Charleston, South Carolina, in order to spend time with Boeing and talk jobs! Look forward to it.","832554772318322688","2017-02-17 11:38:20"
"Despite the long delays by the Democrats in finally approving Dr․ Tom Price, the repeal and replacement of ObamaCare is moving fast!","832533430168608768","2017-02-17 10:13:32"
