"…but complain and obstruct. They made only bad deals (Iran) and their so-called Trade Deals are the laughing stock of the world!","1000152863035805696","2018-05-25 23:13:19"
"WITCH HUNT!","999282325316866048","2018-05-23 13:34:06"
"Big legislation will be signed by me shortly. After many years, RIGHT TO TRY and big changes to DODD FRANK.","999258232110579714","2018-05-23 11:58:22"
"SPYGATE could be one of the biggest political scandals in history!","999246677549768704","2018-05-23 11:12:27"
"“It’s clear that they had eyes and ears all over the Trump Campaign” Judge Andrew Napolitano","999243732506562560","2018-05-23 11:00:45"
"Under our potential deal with China, they will purchase from our Great American Farmers practically as much as our Farmers can produce.","998553122179084290","2018-05-21 13:16:31"
"The Wall Street Journal asks, “WHERE IN THE WORLD WAS BARACK OBAMA?” A very good question!","998546786628395009","2018-05-21 12:51:20"
"On China, Barriers and Tariffs to come down for first time.","998526637657546753","2018-05-21 11:31:16"
