"Republicans must make the horrendous, weak and outdated immigration laws, and the Border, a part of the Midterms!","1052556944068755456","2018-10-17 13:48:25"
"August job openings hit a record 7.14 million. Congratulations USA!","1052537536961306625","2018-10-17 12:31:18"
"AP headline was very different from my quote and meaning in the story. They just can’t help themselves. FAKE NEWS!","1052532141941301248","2018-10-17 12:09:52"
"Stock Market up 548 points today. Also, GREAT jobs numbers!","1052388580734263297","2018-10-17 02:39:24"
"Elizabeth Warren is being hammered, even by the Left. Her false claim of Indian heritage is only selling to VERY LOW I․Q․ individuals!","1052387851088867330","2018-10-17 02:36:30"
"Anybody entering the United States illegally will be arrested and detained, prior to being sent back to their country!","1052369731959820292","2018-10-17 01:24:30"
